{
  "$schema": "../schema/provider.schema.json",
  "provider": "qwen",
  "displayName": "Qwen",
  "detectionPaths": {
    "project": ".qwen",
    "user": "~/.qwen"
  },
  "skillPaths": {
    "project": ".agents/skills",
    "user": "~/.qwen/skills"
  },
  "supports": {
    "description": true,
    "skillMd": true,
    "permissions": false,
    "agentMode": false
  },
  "dangerNotes": [
    "Current local project install remains shared .agents/skills.",
    "Provider-specific permission semantics are not enforced by this baseline."
  ]
}
